{
  "schema": "rusty.quest.sidecar.manifold_route_design_response_expectation.v1",
  "expectation_id": "expectation.manifold_route_design_response.synthetic.001",
  "generated_at": "2026-06-04T23:20:00Z",
  "expectation_status": "ready_for_manifold_owned_response",
  "source_manifold_route_design_review_request": {
    "path": "fixtures/valid/manifold-route-design-review-request.synthetic.json",
    "schema": "rusty.quest.sidecar.manifold_route_design_review_request.v1",
    "request_id": "request.manifold_route_design_review.synthetic.001",
    "request_status": "ready_for_manifold_route_design_review",
    "next_gate": "manifold_repo_design_review_or_operator_decision"
  },
  "response_expectation_scope": {
    "expectation_class": "manifold_owned_design_response_expectation",
    "source_mode": "synthetic_fixture",
    "target_repo": "rusty.manifold",
    "repo_touch_status": "not_touched",
    "response_status": "not_created",
    "decision_status": "not_decided",
    "route_status": "not_created",
    "accepted_state_status": "not_created",
    "audit_record_status": "not_created",
    "hostess_route_status": "not_created",
    "live_evidence_status": "not_included"
  },
  "authority": {
    "expectation_owner": "rusty.quest.sidecar_mesh",
    "response_owner": "rusty.manifold",
    "decision_owner": "rusty.manifold",
    "route_implementation_owner": "rusty.manifold",
    "request_acceptance_owner": "rusty.manifold",
    "runtime_authority_owner": "rusty.manifold",
    "session_authority_owner": "rusty.manifold",
    "audit_owner": "rusty.manifold.audit",
    "accepted_state_owner": "rusty.manifold",
    "rollback_owner": "rusty.manifold",
    "hostess_device_action_authority": "not_in_sidecar",
    "sidecar_role": "observer_proposer",
    "proposal_status": "not_accepted"
  },
  "expected_manifold_response": {
    "response_class": "manifold_owned_design_review_response",
    "response_status": "not_created",
    "decision_status": "not_decided",
    "allowed_decisions": [
      "accepted_for_manifold_slice",
      "revision_requested",
      "rejected"
    ],
    "allowed_response_owner": "rusty.manifold",
    "required_fields": [
      "response_id",
      "request_id",
      "decision",
      "decision_owner",
      "response_owner",
      "created_at",
      "revision",
      "route_ref",
      "schema_refs",
      "accepted_state_ref",
      "audit_ref",
      "rejection_terms",
      "required_revisions",
      "hostess_boundary_ref",
      "privacy_review"
    ],
    "required_rejection_terms": [
      "operator_approval_missing",
      "endpoint_values_rejected",
      "commands_rejected",
      "adb_rejected",
      "stale_peer_status",
      "untrusted_sidecar",
      "redaction_incomplete",
      "high_rate_payload_rejected"
    ],
    "required_revision_terms": [
      "schema_shape_revision",
      "route_semantics_revision",
      "audit_shape_revision",
      "hostess_boundary_revision",
      "privacy_boundary_revision"
    ],
    "required_audit_terms": [
      "request_id",
      "decision",
      "revision",
      "reject_or_revision_reason",
      "accepted_state_ref"
    ],
    "disallowed_response_content": [
      "endpoint_values",
      "shell_text",
      "android_target",
      "pairing_material",
      "package_markers",
      "high_rate_payloads",
      "raw_logs",
      "visual_captures"
    ],
    "accepted_state_policy": "manifold_owned_monotonic_revision",
    "rollback_policy": "manifold_owned_disable_route_or_reject_source"
  },
  "hostess_response_gate": {
    "status": "future_lane_not_requested",
    "route_status": "not_created",
    "device_action_authority": "not_in_sidecar",
    "consumes_only": "manifold_accepted_state_or_operator_request_descriptor",
    "sidecar_direct_input_allowed": false,
    "requires_manifold_accepted_state": true,
    "requires_explicit_operator_request": true,
    "allowed_action_class": "operator_recovery_request_descriptor"
  },
  "validation_evidence": {
    "local_validation_status": "expected_pass",
    "required_commands": [
      "python tools/prepare_manifold_route_design_response_expectation.py --design-review-request fixtures/valid/manifold-route-design-review-request.synthetic.json --now 2026-06-04T23:20:00Z --output fixtures/valid/manifold-route-design-response-expectation.synthetic.json",
      "python tools/evaluate_integration_acceptance.py --repo-root . --now 2026-06-04T21:46:00Z --output fixtures/valid/integration-acceptance-scorecard.synthetic.json",
      "python tools/validate_repo.py --repo-root .",
      "python -m unittest discover -s tests -p test_*.py",
      "git diff --check"
    ],
    "damaged_fixture_policy": "must_fail_validation",
    "future_manifold_gate": "manifold_repo_owns_response_decision_route_state_and_audit",
    "future_hostess_gate": "hostess_route_requires_manifold_state_or_operator_request"
  },
  "privacy_boundary": {
    "contains_endpoint_values": false,
    "contains_pairing_material": false,
    "contains_commands": false,
    "contains_raw_logs": false,
    "contains_visual_captures": false,
    "contains_private_device_ids": false,
    "public_fixture_policy": "synthetic_descriptor_only"
  },
  "checks": [
    {
      "check_id": "route_design_response_expectation.source_request_ready",
      "status": "pass",
      "observed": {
        "schema": "rusty.quest.sidecar.manifold_route_design_review_request.v1",
        "request_status": "ready_for_manifold_route_design_review",
        "next_gate": "manifold_repo_design_review_or_operator_decision"
      },
      "expected": {
        "schema": "rusty.quest.sidecar.manifold_route_design_review_request.v1",
        "request_status": "ready_for_manifold_route_design_review",
        "next_gate": "manifold_repo_design_review_or_operator_decision"
      },
      "evidence": "fixtures/valid/manifold-route-design-review-request.synthetic.json"
    },
    {
      "check_id": "route_design_response_expectation.no_response_route_or_state",
      "status": "pass",
      "observed": {
        "expectation_class": "manifold_owned_design_response_expectation",
        "source_mode": "synthetic_fixture",
        "target_repo": "rusty.manifold",
        "repo_touch_status": "not_touched",
        "response_status": "not_created",
        "decision_status": "not_decided",
        "route_status": "not_created",
        "accepted_state_status": "not_created",
        "audit_record_status": "not_created",
        "hostess_route_status": "not_created",
        "live_evidence_status": "not_included"
      },
      "expected": {
        "repo_touch_status": "not_touched",
        "response_status": "not_created",
        "decision_status": "not_decided",
        "route_status": "not_created",
        "accepted_state_status": "not_created",
        "audit_record_status": "not_created",
        "hostess_route_status": "not_created",
        "live_evidence_status": "not_included"
      },
      "evidence": "response expectation does not touch Manifold, Hostess, route, state, audit, or live evidence"
    },
    {
      "check_id": "route_design_response_expectation.manifold_response_authority",
      "status": "pass",
      "observed": {
        "expectation_owner": "rusty.quest.sidecar_mesh",
        "response_owner": "rusty.manifold",
        "decision_owner": "rusty.manifold",
        "route_implementation_owner": "rusty.manifold",
        "request_acceptance_owner": "rusty.manifold",
        "runtime_authority_owner": "rusty.manifold",
        "session_authority_owner": "rusty.manifold",
        "audit_owner": "rusty.manifold.audit",
        "accepted_state_owner": "rusty.manifold",
        "rollback_owner": "rusty.manifold",
        "hostess_device_action_authority": "not_in_sidecar",
        "sidecar_role": "observer_proposer",
        "proposal_status": "not_accepted"
      },
      "expected": {
        "response_owner": "rusty.manifold",
        "decision_owner": "rusty.manifold",
        "route_implementation_owner": "rusty.manifold",
        "request_acceptance_owner": "rusty.manifold",
        "runtime_authority_owner": "rusty.manifold",
        "session_authority_owner": "rusty.manifold",
        "audit_owner": "rusty.manifold.audit",
        "accepted_state_owner": "rusty.manifold",
        "rollback_owner": "rusty.manifold",
        "sidecar_role": "observer_proposer"
      },
      "evidence": "Manifold remains response, decision, route, request, runtime, session, audit, state, and rollback owner"
    },
    {
      "check_id": "route_design_response_expectation.response_envelope_constrained",
      "status": "pass",
      "observed": {
        "response_status": "not_created",
        "decision_status": "not_decided",
        "allowed_decisions": [
          "accepted_for_manifold_slice",
          "revision_requested",
          "rejected"
        ],
        "allowed_response_owner": "rusty.manifold",
        "required_field_count": 15,
        "required_rejection_terms": [
          "operator_approval_missing",
          "endpoint_values_rejected",
          "commands_rejected",
          "adb_rejected",
          "stale_peer_status",
          "untrusted_sidecar",
          "redaction_incomplete",
          "high_rate_payload_rejected"
        ],
        "required_revision_terms": [
          "schema_shape_revision",
          "route_semantics_revision",
          "audit_shape_revision",
          "hostess_boundary_revision",
          "privacy_boundary_revision"
        ],
        "disallowed_response_content": [
          "endpoint_values",
          "shell_text",
          "android_target",
          "pairing_material",
          "package_markers",
          "high_rate_payloads",
          "raw_logs",
          "visual_captures"
        ]
      },
      "expected": {
        "response_status": "not_created",
        "decision_status": "not_decided",
        "allowed_decisions": [
          "accepted_for_manifold_slice",